{
  "schema": "pramagraph.financial_corpus_audit.v1",
  "files": [
    {
      "file": "btc_calib.csv",
      "role": "CALIBRATION",
      "instrument_id": "crypto:binance:BTCUSDT",
      "expected_rows": 800,
      "actual_rows": 800,
      "valid_rows": 800,
      "malformed_rows_excluded": 0,
      "expected_start": "2023-01-18",
      "actual_start": "2023-01-18",
      "expected_end": "2026-02-20",
      "actual_end": "2026-02-20",
      "cadence_anomalies": 164,
      "volume_available_rows": 0,
      "volume_unavailable_rows": 800,
      "input_sha256": "sha256:832703c05ed61404a5e4e84c72335fdd7afaef2f0600eee5b0eba9e8684f1a6e",
      "status": "ACCEPTED",
      "accepted": true
    },
    {
      "file": "btc_stooq.csv",
      "role": "HISTORICAL",
      "instrument_id": "crypto:binance:BTCUSDT",
      "expected_rows": 4036,
      "actual_rows": 4036,
      "valid_rows": 4036,
      "malformed_rows_excluded": 0,
      "expected_start": "2010-07-19",
      "actual_start": "2010-07-19",
      "expected_end": "2026-02-20",
      "actual_end": "2026-02-20",
      "cadence_anomalies": 823,
      "volume_available_rows": 0,
      "volume_unavailable_rows": 4036,
      "input_sha256": "sha256:a39974c14c7d96eecfec4cab83188ed7558f28e653964c36a34c508b0a498173",
      "status": "ACCEPTED",
      "accepted": true
    },
    {
      "file": "gold_calib.csv",
      "role": "CALIBRATION",
      "instrument_id": "futures:massive:GC",
      "expected_rows": 800,
      "actual_rows": 800,
      "valid_rows": 800,
      "malformed_rows_excluded": 0,
      "expected_start": "2023-01-17",
      "actual_start": "2023-01-17",
      "expected_end": "2026-02-20",
      "actual_end": "2026-02-20",
      "cadence_anomalies": 0,
      "volume_available_rows": 0,
      "volume_unavailable_rows": 800,
      "input_sha256": "sha256:b9574afdbff404ead9187b3d689b99e609103694c5b58c0176c6318f4cb83704",
      "status": "ACCEPTED",
      "accepted": true
    },
    {
      "file": "gold_stooq.csv",
      "role": "HISTORICAL",
      "instrument_id": "futures:massive:GC",
      "expected_rows": 15186,
      "actual_rows": 15186,
      "valid_rows": 15186,
      "malformed_rows_excluded": 0,
      "expected_start": "1793-03-01",
      "actual_start": "1793-03-01",
      "expected_end": "2026-02-20",
      "actual_end": "2026-02-20",
      "cadence_anomalies": 734,
      "volume_available_rows": 0,
      "volume_unavailable_rows": 15186,
      "input_sha256": "sha256:431090e147380451039359a3eaf862f3b1e90aadbd986e3ccd2296aef6836ed5",
      "status": "ACCEPTED",
      "accepted": true
    },
    {
      "file": "nasdaq_calib.csv",
      "role": "CALIBRATION",
      "instrument_id": "index:massive:NDX",
      "expected_rows": 800,
      "actual_rows": 800,
      "valid_rows": 800,
      "malformed_rows_excluded": 0,
      "expected_start": "2022-12-12",
      "actual_start": "2022-12-12",
      "expected_end": "2026-02-20",
      "actual_end": "2026-02-20",
      "cadence_anomalies": 0,
      "volume_available_rows": 800,
      "volume_unavailable_rows": 0,
      "input_sha256": "sha256:c94aa633e297906da426d940bdfda9ac5b37a234ea7e64ccba01bb8b59c226e4",
      "status": "ACCEPTED",
      "accepted": true
    },
    {
      "file": "nasdaq_stooq.csv",
      "role": "HISTORICAL",
      "instrument_id": "index:massive:NDX",
      "expected_rows": 10176,
      "actual_rows": 10176,
      "valid_rows": 10174,
      "malformed_rows_excluded": 2,
      "expected_start": "1985-10-01",
      "actual_start": "1985-10-01",
      "expected_end": "2026-02-20",
      "actual_end": "2026-02-20",
      "cadence_anomalies": 3,
      "volume_available_rows": 10174,
      "volume_unavailable_rows": 0,
      "input_sha256": "sha256:0048a6ecf2638e3e05f28273ee52b5040001606205546e45f77937ebb5e21954",
      "status": "ACCEPTED_WITH_EXCLUSIONS",
      "accepted": true
    },
    {
      "file": "sp500_calib.csv",
      "role": "CALIBRATION",
      "instrument_id": "index:massive:SPX",
      "expected_rows": 800,
      "actual_rows": 800,
      "valid_rows": 800,
      "malformed_rows_excluded": 0,
      "expected_start": "2022-12-12",
      "actual_start": "2022-12-12",
      "expected_end": "2026-02-20",
      "actual_end": "2026-02-20",
      "cadence_anomalies": 0,
      "volume_available_rows": 800,
      "volume_unavailable_rows": 0,
      "input_sha256": "sha256:d41340eb68958937ba1e98d25109559a033207cad0dd27d90a6dfdef6d509156",
      "status": "ACCEPTED",
      "accepted": true
    },
    {
      "file": "sp500_stooq.csv",
      "role": "HISTORICAL",
      "instrument_id": "index:massive:SPX",
      "expected_rows": 39639,
      "actual_rows": 39639,
      "valid_rows": 39639,
      "malformed_rows_excluded": 0,
      "expected_start": "1789-05-01",
      "actual_start": "1789-05-01",
      "expected_end": "2026-02-20",
      "actual_end": "2026-02-20",
      "cadence_anomalies": 1162,
      "volume_available_rows": 19242,
      "volume_unavailable_rows": 20397,
      "input_sha256": "sha256:0949a29543a0b6aae2e9be66652850959f9342d04293b30b69e3870ac1bbe681",
      "status": "ACCEPTED",
      "accepted": true
    },
    {
      "file": "xrp_calib.csv",
      "role": "CALIBRATION",
      "instrument_id": "crypto:binance:XRPUSDT",
      "expected_rows": 800,
      "actual_rows": 800,
      "valid_rows": 800,
      "malformed_rows_excluded": 0,
      "expected_start": "2023-12-16",
      "actual_start": "2023-12-16",
      "expected_end": "2026-02-22",
      "actual_end": "2026-02-22",
      "cadence_anomalies": 0,
      "volume_available_rows": 800,
      "volume_unavailable_rows": 0,
      "input_sha256": "sha256:ff988dc105665896601a6c99fddcaa553b241123f8142d1aa2d61d2cb71ea1f5",
      "status": "ACCEPTED",
      "accepted": true
    },
    {
      "file": "xrp_stooq.csv",
      "role": "HISTORICAL",
      "instrument_id": "crypto:binance:XRPUSDT",
      "expected_rows": 4048,
      "actual_rows": 4048,
      "valid_rows": 4048,
      "malformed_rows_excluded": 0,
      "expected_start": "2015-01-21",
      "actual_start": "2015-01-21",
      "expected_end": "2026-02-22",
      "actual_end": "2026-02-22",
      "cadence_anomalies": 1,
      "volume_available_rows": 1517,
      "volume_unavailable_rows": 2531,
      "input_sha256": "sha256:668024a9dbc834540bb4067a7050ad1c1cd07d92219fca8b64e43f881525a8b3",
      "status": "ACCEPTED",
      "accepted": true
    }
  ],
  "all_files_accepted": true,
  "report_sha256": "sha256:b04b71c72e542b0d3901632c58c4d6ca122ca8255e66876d6262b6510f5cb5b4"
}
